{"labels":[{"failure_id":"6bd0744622592221d0ccac8933db8b5b6ea81b0dcec78ff3cff2b83acce00530","mode":"refund-amount"},{"failure_id":"e744633aa86cae13faf86a1d890e2e28a9e6a90f3c202ace74639be74b686882","mode":"refund-amount"},{"failure_id":"2e96a591e25f37ffe915c2516c53f8c04d14020fd255f6dec0507befe4fead9a","mode":"refund-duplicate"},{"failure_id":"fb8dd21bd49a83b7cca0b5430121a720d34c20796c47a57cda1768298df72099","mode":"refund-duplicate"},{"failure_id":"d6deafe347fac26631a7d1c8b8e5b59ba9c13fbca6753041d93b5564f1264662","mode":"tool-validation"},{"failure_id":"490ec07e1038288debb055d9633f8637456a020624abfac861de233cdf3201c5","mode":"tool-validation"},{"failure_id":"d67f9f3348cf6523d0d74a69c4ebfe913dc4eea304d307facab2c3270424a4c8","mode":"provider-outage"},{"failure_id":"167a029152ff1ee5bebd7dea179d587d1e9d8983112e3f7a636247c1e6a3436f","mode":"provider-outage"},{"failure_id":"fc5b42874d528bc57548279dda52d7426d9045f80b64c90659eb8a67c0595266","mode":"refund-amount"},{"failure_id":"b1ce8e7effbd047e0b4dd21f97290537ed8980dca5f3ce0b86c3b75e2701573c","mode":"shipping-address"}],"review":{"reason":"Synthetic known modes","reviewer":"fixture-author"},"schema_version":"experience.labels.v1","scope":"synthetic"}
